artifact,required_in_git,purpose
sweep_results.csv,yes,per-combo metrics from sweep writer
runtime_candidate_root,src/strategies/testing_parameters_results/l1_execution_backed_controlled,combiner load_candidates root after promote --write
*.yaml,yes (after promote),must use strategy config metrics metadata selection source per combiner.candidate
CANDIDATE_INDEX.csv,yes (after promote),id to yaml path
selected_candidates_summary.csv,yes (after promote),promoted rows
candidate_rejects_summary.csv,yes (after promote),gate failures
research_staging_selected_candidates,optional,audit only under layer1_execution_backed_controlled/selected_candidates
